{
  "schemaVersion": "0.4",
  "planningReference": "RST-20251126-0700AD3D",
  "publicHolidays": [],
  "solverRun": {
    "runId": "SRN-local-0.4",
    "solverVersion": "optfold-py-0.4.2",
    "startedAt": "2025-11-26T11:25:57.319737",
    "ended": "2025-11-26T11:25:57.552661",
    "durationSeconds": 0.233,
    "status": "INFEASIBLE",
    "optimizedRotationOffsets": {
      "00097227": 2,
      "00105501": 1,
      "00149072": 1,
      "00173519": 1,
      "00174104": 3
    }
  },
  "score": {
    "overall": 91,
    "hard": 91,
    "soft": 0
  },
  "scoreBreakdown": {
    "hard": {
      "violations": [
        {
          "type": "hard",
          "id": "hard-unknown",
          "note": "Slot DI-2511251338-43242314-8_1-D-P0-2025-12-02-520722 on 2025-12-02 for DI-2511251338-43242314 is unassigned"
        },
        {
          "type": "hard",
          "id": "hard-unknown",
          "note": "Slot DI-2511251338-43242314-8_1-D-P0-2025-12-03-cd7d86 on 2025-12-03 for DI-2511251338-43242314 is unassigned"
        },
        {
          "type": "hard",
          "id": "hard-unknown",
          "note": "Slot DI-2511251338-43242314-8_1-D-P0-2025-12-04-ac6fc5 on 2025-12-04 for DI-2511251338-43242314 is unassigned"
        },
        {
          "type": "hard",
          "id": "hard-unknown",
          "note": "Slot DI-2511251338-43242314-8_1-D-P0-2025-12-05-31b72f on 2025-12-05 for DI-2511251338-43242314 is unassigned"
        },
        {
          "type": "hard",
          "id": "hard-unknown",
          "note": "Slot DI-2511251338-43242314-8_1-D-P0-2025-12-16-f44838 on 2025-12-16 for DI-2511251338-43242314 is unassigned"
        },
        {
          "type": "hard",
          "id": "hard-unknown",
          "note": "Slot DI-2511251338-43242314-8_1-D-P0-2025-12-18-5237cf on 2025-12-18 for DI-2511251338-43242314 is unassigned"
        },
        {
          "type": "hard",
          "id": "hard-unknown",
          "note": "Slot DI-2511251338-43242314-8_1-D-P0-2025-12-20-5d546e on 2025-12-20 for DI-2511251338-43242314 is unassigned"
        },
        {
          "type": "hard",
          "id": "hard-unknown",
          "note": "Slot DI-2511251338-43242314-8_1-D-P0-2025-12-23-2e01d5 on 2025-12-23 for DI-2511251338-43242314 is unassigned"
        },
        {
          "type": "hard",
          "id": "hard-unknown",
          "note": "Slot DI-2511251338-43242314-8_1-D-P0-2025-12-25-b59408 on 2025-12-25 for DI-2511251338-43242314 is unassigned"
        },
        {
          "type": "hard",
          "id": "hard-unknown",
          "note": "Slot DI-2511251338-43242314-8_1-D-P0-2025-12-26-37f2be on 2025-12-26 for DI-2511251338-43242314 is unassigned"
        },
        {
          "type": "hard",
          "id": "hard-unknown",
          "note": "Slot DI-2511251338-43242314-8_1-D-P1-2025-12-02-c0c56f on 2025-12-02 for DI-2511251338-43242314 is unassigned"
        },
        {
          "type": "hard",
          "id": "hard-unknown",
          "note": "Slot DI-2511251338-43242314-8_1-D-P1-2025-12-16-a4c4df on 2025-12-16 for DI-2511251338-43242314 is unassigned"
        },
        {
          "type": "hard",
          "id": "hard-unknown",
          "note": "Slot DI-2511251338-43242314-8_1-D-P1-2025-12-20-00b564 on 2025-12-20 for DI-2511251338-43242314 is unassigned"
        },
        {
          "type": "hard",
          "id": "hard-unknown",
          "note": "Slot DI-2511251338-43242314-8_1-D-P1-2025-12-25-6b81b7 on 2025-12-25 for DI-2511251338-43242314 is unassigned"
        },
        {
          "type": "hard",
          "id": "hard-unknown",
          "note": "Slot DI-2511251338-43242314-8_1-D-P1-2025-12-26-d933c5 on 2025-12-26 for DI-2511251338-43242314 is unassigned"
        },
        {
          "type": "hard",
          "id": "hard-unknown",
          "note": "Slot DI-2511251338-43242314-8_1-D-P1-2025-12-27-cfeca4 on 2025-12-27 for DI-2511251338-43242314 is unassigned"
        },
        {
          "type": "hard",
          "id": "hard-unknown",
          "note": "Slot DI-2511251338-43242314-8_1-D-P2-2025-12-20-f8685a on 2025-12-20 for DI-2511251338-43242314 is unassigned"
        },
        {
          "type": "hard",
          "id": "hard-unknown",
          "note": "Slot DI-2511251338-43242314-8_1-D-P2-2025-12-26-b490e0 on 2025-12-26 for DI-2511251338-43242314 is unassigned"
        },
        {
          "type": "hard",
          "id": "hard-unknown",
          "note": "Slot DI-2511251338-43242314-8_1-N-P0-2025-12-02-7ec573 on 2025-12-02 for DI-2511251338-43242314 is unassigned"
        },
        {
          "type": "hard",
          "id": "hard-unknown",
          "note": "Slot DI-2511251338-43242314-8_1-N-P0-2025-12-03-704cf9 on 2025-12-03 for DI-2511251338-43242314 is unassigned"
        },
        {
          "type": "hard",
          "id": "hard-unknown",
          "note": "Slot DI-2511251338-43242314-8_1-N-P0-2025-12-09-0791d7 on 2025-12-09 for DI-2511251338-43242314 is unassigned"
        },
        {
          "type": "hard",
          "id": "hard-unknown",
          "note": "Slot DI-2511251338-43242314-8_1-N-P0-2025-12-10-a75b1f on 2025-12-10 for DI-2511251338-43242314 is unassigned"
        },
        {
          "type": "hard",
          "id": "hard-unknown",
          "note": "Slot DI-2511251338-43242314-8_1-N-P0-2025-12-11-77ee2c on 2025-12-11 for DI-2511251338-43242314 is unassigned"
        },
        {
          "type": "hard",
          "id": "hard-unknown",
          "note": "Slot DI-2511251338-43242314-8_1-N-P0-2025-12-12-636c75 on 2025-12-12 for DI-2511251338-43242314 is unassigned"
        },
        {
          "type": "hard",
          "id": "hard-unknown",
          "note": "Slot DI-2511251338-43242314-8_1-N-P0-2025-12-13-45db5d on 2025-12-13 for DI-2511251338-43242314 is unassigned"
        },
        {
          "type": "hard",
          "id": "hard-unknown",
          "note": "Slot DI-2511251338-43242314-8_1-N-P1-2025-12-02-2ca81e on 2025-12-02 for DI-2511251338-43242314 is unassigned"
        },
        {
          "type": "hard",
          "id": "hard-unknown",
          "note": "Slot DI-2511251338-43242314-8_1-N-P1-2025-12-03-342468 on 2025-12-03 for DI-2511251338-43242314 is unassigned"
        },
        {
          "type": "hard",
          "id": "hard-unknown",
          "note": "Slot DI-2511251338-43242314-8_1-N-P1-2025-12-04-8fe8e0 on 2025-12-04 for DI-2511251338-43242314 is unassigned"
        },
        {
          "type": "hard",
          "id": "hard-unknown",
          "note": "Slot DI-2511251338-43242314-8_1-N-P1-2025-12-05-a23cdf on 2025-12-05 for DI-2511251338-43242314 is unassigned"
        },
        {
          "type": "hard",
          "id": "hard-unknown",
          "note": "Slot DI-2511251338-43242314-8_1-N-P1-2025-12-06-b059e9 on 2025-12-06 for DI-2511251338-43242314 is unassigned"
        },
        {
          "type": "hard",
          "id": "hard-unknown",
          "note": "Slot DI-2511251338-43242314-8_1-N-P1-2025-12-09-d9bcbd on 2025-12-09 for DI-2511251338-43242314 is unassigned"
        },
        {
          "type": "hard",
          "id": "hard-unknown",
          "note": "Slot DI-2511251338-43242314-8_1-N-P1-2025-12-10-b1bfcd on 2025-12-10 for DI-2511251338-43242314 is unassigned"
        },
        {
          "type": "hard",
          "id": "hard-unknown",
          "note": "Slot DI-2511251338-43242314-8_1-N-P1-2025-12-11-5cd8d9 on 2025-12-11 for DI-2511251338-43242314 is unassigned"
        },
        {
          "type": "hard",
          "id": "hard-unknown",
          "note": "Slot DI-2511251338-43242314-8_1-N-P1-2025-12-12-94b0b3 on 2025-12-12 for DI-2511251338-43242314 is unassigned"
        },
        {
          "type": "hard",
          "id": "hard-unknown",
          "note": "Slot DI-2511251338-43242314-8_1-N-P1-2025-12-13-9ad79f on 2025-12-13 for DI-2511251338-43242314 is unassigned"
        },
        {
          "type": "hard",
          "id": "hard-unknown",
          "note": "Slot DI-2511251338-43242314-8_1-N-P1-2025-12-16-20f611 on 2025-12-16 for DI-2511251338-43242314 is unassigned"
        },
        {
          "type": "hard",
          "id": "hard-unknown",
          "note": "Slot DI-2511251338-43242314-8_1-N-P1-2025-12-17-fe4ad8 on 2025-12-17 for DI-2511251338-43242314 is unassigned"
        },
        {
          "type": "hard",
          "id": "hard-unknown",
          "note": "Slot DI-2511251338-43242314-8_1-N-P1-2025-12-18-1d09b2 on 2025-12-18 for DI-2511251338-43242314 is unassigned"
        },
        {
          "type": "hard",
          "id": "hard-unknown",
          "note": "Slot DI-2511251338-43242314-8_1-N-P1-2025-12-19-8b0804 on 2025-12-19 for DI-2511251338-43242314 is unassigned"
        },
        {
          "type": "hard",
          "id": "hard-unknown",
          "note": "Slot DI-2511251338-43242314-8_1-N-P1-2025-12-20-2b4d89 on 2025-12-20 for DI-2511251338-43242314 is unassigned"
        },
        {
          "type": "hard",
          "id": "hard-unknown",
          "note": "Slot DI-2511251338-43242314-8_1-N-P1-2025-12-23-562b4d on 2025-12-23 for DI-2511251338-43242314 is unassigned"
        },
        {
          "type": "hard",
          "id": "hard-unknown",
          "note": "Slot DI-2511251338-43242314-8_1-N-P1-2025-12-24-60e0a5 on 2025-12-24 for DI-2511251338-43242314 is unassigned"
        },
        {
          "type": "hard",
          "id": "hard-unknown",
          "note": "Slot DI-2511251338-43242314-8_1-N-P1-2025-12-25-2cb96a on 2025-12-25 for DI-2511251338-43242314 is unassigned"
        },
        {
          "type": "hard",
          "id": "hard-unknown",
          "note": "Slot DI-2511251338-43242314-8_1-N-P1-2025-12-26-25522d on 2025-12-26 for DI-2511251338-43242314 is unassigned"
        },
        {
          "type": "hard",
          "id": "hard-unknown",